### ISSUE TITLE
30-second Request

### ISSUE THREAD

**Issue by nv4010** [emqx/emqx#15532]
### What happened?

Android client network request
18:47:08.877552 rmnet_data1 In IP xxxx.1883 > 100.111.84.220.43258: Flags [.], ack 631, win 501, length 0
18:47:08.877725 rmnet_data1 Out IP 100.111.84.220.43258 > 141.105.68.141.1883: Flags [.], ack 14, win 32, length 0

Server
18:48:09.365772 IP (tos 0x15,ECT(1), ttl 242, id 15928, offset 0, flags [none], proto TCP (6), length 40)
    119.234.66.251.25647 > 50682.example.ru.mqtt: Flags [.], cksum 0xee51 (correct), seq 630, ack 14, win 32, length 0
18:48:09.365835 IP (tos 0x0, ttl 63, id 11559, offset 0, flags [DF], proto TCP (6), length 40)
    50682.example.ru.mqtt > 119.234.66.251.25647: Flags [.], cksum 0x8cf6 (incorrect -> 0xec7b), seq 14, ack 631, win 501, length 0
1
The problem is that this 30-second connection is triggered when using an overseas SIM card.
mqttConnectOptions.setKeepAliveInterval(0) is set to 0 here.

### What did you expect to happen?

Problem

### EMQX version

<details>

```console
$ ./bin/emqx_ctl broker
# paste output here
```

</details>

### OS version

<details>

```console
# On Linux:
$ cat /etc/os-release
# paste output here
$ uname -a
# paste output here
```

</details>

### Log files

<details>

</details>

---
*This issue was automatically translated from Chinese.*

**Comment by zmstone** [comment]
Hi @nv4010 

The two pairs of TCP packets are approximately 60 seconds apart, not 30 seconds as initially mentioned.

These packets appear to be idle ACKs — they are not MQTT PINGREQ/PINGRESP messages, ~and they also do not match the pattern of standard TCP keepalive probes.~ they seem to be TCP keepalive probes.

It’s possible that these packets are triggered by the device’s network stack or by the mobile carrier to prevent the connection from being closed due to inactivity (e.g., NAT timeout). You may want to check with the network provider to confirm if such behavior is expected on their network.

**Comment by nv4010** [comment]
Is there any way to solve this problem? I can't ask the operator to solve it.

**Comment by nv4010** [comment]
The data shows that it is not PINGREQ/PINGRESP

**Comment by zmstone** [comment]
Hi @nv4010 
That's correct. The tcp dump results show the data length is 0.
MQTT PINGREQ/PINGRESP should be two bytes.

I do not understand why you think it's a problem.

**Comment by nv4010** [comment]
Because I am developing a low-power project, ack will trigger Android network wake-up, causing 40ma current
