### ISSUE TITLE
recv client_disconnected:keepalive_timeout when pingreq still

### ISSUE THREAD

**Issue by seqwait** [emqx/emqx#4749]
1. emqx version:4.0
2. haproxy:1.8
listen mqtt_proxy
	bind	*:1884
	mode	tcp
	option	clitcpka
	option	tcplog
	timeout client	600s
	timeout	server 50s
	timeout	check 5000
	balance	leastconn
	server  emq1	172.17.110.203:1883 check inter 10000 fall 2 rise 5 weight 1 maxconn 50000
	server emq2	172.17.110.204:1883 check inter 10000 fall 2 rise 5 weight 1 maxconn 50000
        server  emq3    172.17.110.196:1883 check inter 10000 fall 2 rise 5 weight 1 maxconn 50000

tcpdump package:
```
16:12:56.203181 IP 172.17.110.204.1884 > 112.96.67.129.36701: Flags [P.], seq 23:25, ack 391, win 243, options [nop,nop,TS val 2748767530 ecr 1485457], length 2
16:12:56.262803 IP 112.96.67.129.36701 > 172.17.110.204.1884: Flags [.], ack 25, win 296, options [nop,nop,TS val 1485465 ecr 2748767530], length 0
16:13:56.243161 IP 112.96.67.129.36701 > 172.17.110.204.1884: Flags [P.], seq 391:393, ack 25, win 296, options [nop,nop,TS val 1489626 ecr 2748767530], length 2
16:13:56.243455 IP 172.17.110.204.1884 > 112.96.67.129.36701: Flags [P.], seq 25:27, ack 393, win 243, options [nop,nop,TS val 2748827570 ecr 1489626], length 2
16:13:56.302849 IP 112.96.67.129.36701 > 172.17.110.204.1884: Flags [.], ack 27, win 296, options [nop,nop,TS val 1489635 ecr 2748827570], length 0
16:14:56.142958 IP 112.96.67.129.36701 > 172.17.110.204.1884: Flags [P.], seq 393:395, ack 27, win 296, options [nop,nop,TS val 1491447 ecr 2748827570], length 2
16:14:56.143217 IP 172.17.110.204.1884 > 112.96.67.129.36701: Flags [P.], seq 27:29, ack 395, win 243, options [nop,nop,TS val 2748887470 ecr 1491447], length 2
16:14:56.202769 IP 112.96.67.129.36701 > 172.17.110.204.1884: Flags [.], ack 29, win 296, options [nop,nop,TS val 1491455 ecr 2748887470], length 0
16:17:08.842217 IP 172.17.110.204.1884 > 112.96.67.129.36701: Flags [F.], seq 29, ack 395, win 243, options [nop,nop,TS val 2749020169 ecr 1491455], length 0
16:17:08.951889 IP 112.96.67.129.36701 > 172.17.110.204.1884: Flags [.], ack 30, win 296, options [nop,nop,TS val 1504729 ecr 2749020169], length 0
16:17:08.951920 IP 112.96.67.129.36701 > 172.17.110.204.1884: Flags [F.], seq 395, ack 30, win 296, options [nop,nop,TS val 1504730 ecr 2749020169], length 0
16:17:08.951934 IP 172.17.110.204.1884 > 112.96.67.129.36701: Flags [.], ack 396, win 243, options [nop,nop,TS val 2749020279 ecr 1504730], length 0
16:17:10.051378 IP 112.96.67.129.36702 > 172.17.110.204.1884: Flags [S], seq 935573627, win 65535, options [mss 1260,sackOK,TS val 1504839 ecr 0,nop,wscale 8], length 0
16:17:10.051416 IP 172.17.110.204.1884 > 112.96.67.129.36702: Flags [S.], seq 1360939913, ack 935573628, win 28960, options [mss 1460,sackOK,TS val 2749021378 ecr 1504839,nop,wscale 7], length 0
16:17:10.111174 IP 112.96.67.129.36702 > 172.17.110.204.1884: Flags [.], ack 1, win 296, options [nop,nop,TS val 1504846 ecr 2749021378], length 0
16:17:10.139240 IP 112.96.67.129.36702 > 172.17.110.204.1884: Flags [P.], seq 1:194, ack 1, win 296, options [nop,nop,TS val 1504848 ecr 2749021378], length 193
16:17:10.139264 IP 172.17.110.204.1884 > 112.96.67.129.36702: Flags [.], ack 194, win 235, options [nop,nop,TS val 2749021466 ecr 1504848], length 0
16:17:10.143383 IP 172.17.110.204.1884 > 112.96.67.129.36702: Flags [P.], seq 1:5, ack 194, win 235, options [nop,nop,TS val 2749021470 ecr 1504848], length 4
16:17:10.152701 IP 172.17.110.204.1884 > 112.96.67.129.36702: Flags [P.], seq 5:260, ack 194, win 235, options [nop,nop,TS val 2749021479 ecr 1504848], length 255
16:17:10.211203 IP 112.96.67.129.36702 > 172.17.110.204.1884: Flags [.], ack 5, win 296, options [nop,nop,TS val 1504855 ecr 2749021470], length 0
16:17:10.211220 IP 112.96.67.129.36702 > 172.17.110.204.1884: Flags [.], ack 260, win 300, options [nop,nop,TS val 1504856 ecr 2749021479], length 0
16:17:10.271221 IP 112.96.67.129.36702 > 172.17.110.204.1884: Flags [P.], seq 194:198, ack 260, win 300, options [nop,nop,TS val 1504860 ecr 2749021479], length 4
16:17:10.272409 IP 172.17.110.204.1884 > 112.96.67.129.36702: Flags [P.], seq 260:264, ack 198, win 235, options [nop,nop,TS val 2749021599 ecr 1504860], length 4
16:17:10.332314 IP 112.96.67.129.36702 > 172.17.110.204.1884: Flags [.], ack 264, win 300, options [nop,nop,TS val 1504868 ecr 2749021599], length 0
16:17:10.371199 IP 112.96.67.129.36702 > 172.17.110.204.1884: Flags [P.], seq 198:202, ack 264, win 300, options [nop,nop,TS val 1504871 ecr 2749021599], length 4
16:17:10.410880 IP 172.17.110.204.1884 > 112.96.67.129.36702: Flags [.], ack 202, win 235, options [nop,nop,TS val 2749021738 ecr 1504871], length 0
16:18:11.251428 IP 112.96.67.129.36702 > 172.17.110.204.1884: Flags [P.], seq 202:204, ack 264, win 300, options [nop,nop,TS val 1509373 ecr 2749021738], length 2
16:18:11.251458 IP 172.17.110.204.1884 > 112.96.67.129.36702: Flags [.], ack 204, win 235, options [nop,nop,TS val 2749082578 ecr 1509373], length 0
16:18:11.251666 IP 172.17.110.204.1884 > 112.96.67.129.36702: Flags [P.], seq 264:266, ack 204, win 235, options [nop,nop,TS val 2749082578 ecr 1509373], length 2
16:18:11.350949 IP 112.96.67.129.36702 > 172.17.110.204.1884: Flags [.], ack 266, win 300, options [nop,nop,TS val 1509384 ecr 2749082578], length 0
16:19:11.271440 IP 112.96.67.129.36702 > 172.17.110.204.1884: Flags [P.], seq 204:206, ack 266, win 300, options [nop,nop,TS val 1515374 ecr 2749082578], length 2
16:19:11.271648 IP 172.17.110.204.1884 > 112.96.67.129.36702: Flags [P.], seq 266:268, ack 206, win 235, options [nop,nop,TS val 2749142598 ecr 1515374], length 2
16:19:11.331337 IP 112.96.67.129.36702 > 172.17.110.204.1884: Flags [.], ack 268, win 300, options [nop,nop,TS val 1515382 ecr 2749142598], length 0
16:20:55.148268 IP 172.17.110.204.1884 > 112.96.67.129.36702: Flags [F.], seq 268, ack 206, win 235, options [nop,nop,TS val 2749246475 ecr 1515382], length 0
16:20:55.413880 IP 172.17.110.204.1884 > 112.96.67.129.36702: Flags [F.], seq 268, ack 206, win 235, options [nop,nop,TS val 2749246741 ecr 1515382], length 0
16:20:55.679880 IP 172.17.110.204.1884 > 112.96.67.129.36702: Flags [F.], seq 268, ack 206, win 235, options [nop,nop,TS val 2749247007 ecr 1515382], length 0
16:20:56.210879 IP 172.17.110.204.1884 > 112.96.67.129.36702: Flags [F.], seq 268, ack 206, win 235, options [nop,nop,TS val 2749247538 ecr 1515382], length 0
16:20:57.272883 IP 172.17.110.204.1884 > 112.96.67.129.36702: Flags [F.], seq 268, ack 206, win 235, options [nop,nop,TS val 2749248600 ecr 1515382], length 0
16:20:59.400882 IP 172.17.110.204.1884 > 112.96.67.129.36702: Flags [F.], seq 268, ack 206, win 235, options [nop,nop,TS val 2749250728 ecr 1515382], length 0
16:21:03.648881 IP 172.17.110.204.1884 > 112.96.67.129.36702: Flags [F.], seq 268, ack 206, win 235, options [nop,nop,TS val 2749254976 ecr 1515382], length 0
16:21:12.160888 IP 172.17.110.204.1884 > 112.96.67.129.36702: Flags [F.], seq 268, ack 206, win 235, options [nop,nop,TS val 2749263488 ecr 1515382], length 0
16:21:29.184881 IP 172.17.110.204.1884 > 112.96.67.129.36702: Flags [F.], seq 268, ack 206, win 235, options [nop,nop,TS val 2749280512 ecr 1515382], length 0
16:22:03.232883 IP 172.17.110.204.1884 > 112.96.67.129.36702: Flags [F.], seq 268, ack 206, win 235, options [nop,nop,TS val 2749314560 ecr 1515382], length 0
16:23:11.328898 IP 172.17.110.204.1884 > 112.96.67.129.36702: Flags [F.], seq 268, ack 206, win 235, options [nop,nop,TS val 2749382656 ecr 1515382], length 0
```
3. hook action
```
15:14:32.017=>
{"action":"client_connected","clientid":"android_16682204_7391581","username":"16682204","ipaddress":"172.17.110.204","keepalive":60,"proto_ver":4,"connected_at":1620371672,"conn_ack":0}

15:15:09.774=>
{"action":"client_disconnected","clientid":"android_16682204_7391581","username":"16682204","reason":"tcp_closed"}
```

**Comment by terry-xiaoyu** [comment]
Make sure the keepalive in your MQTT CONNECT message is less than the min timeout of haproxy's (timeout-client  and timeout-server). That is 50s in your example so try use a keepalive = 30.
